fun	lemma	pos	nominative	genitive	prepositional	accusative	instrumental
absurd_N	邪斜褋褍褉写	noun	邪斜褋褍褉写	邪斜褋褍褉写邪	邪斜褋褍褉写械	邪斜褋褍褉写	邪斜褋褍褉写芯屑
avtonomiya_N	邪胁褌芯薪芯屑懈褟	noun	邪胁褌芯薪芯屑懈褟	邪胁褌芯薪芯屑懈懈	邪胁褌芯薪芯屑懈懈	邪胁褌芯薪芯屑懈褞	邪胁褌芯薪芯屑懈械泄
agentnost_N	邪谐械薪褌薪芯褋褌褜	noun	邪谐械薪褌薪芯褋褌褜	邪谐械薪褌薪芯褋褌懈	邪谐械薪褌薪芯褋褌懈	邪谐械薪褌薪芯褋褌褜	邪谐械薪褌薪芯褋褌褜褞
aksioma_N	邪泻褋懈芯屑邪	noun	邪泻褋懈芯屑邪	邪泻褋懈芯屑褘	邪泻褋懈芯屑械	邪泻褋懈芯屑褍	邪泻褋懈芯屑芯泄
antitezis_N	邪薪褌懈褌械蟹懈褋	noun	邪薪褌懈褌械蟹懈褋	邪薪褌懈褌械蟹懈褋邪	邪薪褌懈褌械蟹懈褋械	邪薪褌懈褌械蟹懈褋	邪薪褌懈褌械蟹懈褋芯屑
argument_N	邪褉谐褍屑械薪褌	noun	邪褉谐褍屑械薪褌	邪褉谐褍屑械薪褌邪	邪褉谐褍屑械薪褌械	邪褉谐褍屑械薪褌	邪褉谐褍屑械薪褌芯屑
bol_N	斜芯谢褜	noun	斜芯谢褜	斜芯谢懈	斜芯谢懈	斜芯谢褜	斜芯谢褜褞
validnost_N	胁邪谢懈写薪芯褋褌褜	noun	胁邪谢懈写薪芯褋褌褜	胁邪谢懈写薪芯褋褌懈	胁邪谢懈写薪芯褋褌懈	胁邪谢懈写薪芯褋褌褜	胁邪谢懈写薪芯褋褌褜褞
veroyatnost_N	胁械褉芯褟褌薪芯褋褌褜	noun	胁械褉芯褟褌薪芯褋褌褜	胁械褉芯褟褌薪芯褋褌懈	胁械褉芯褟褌薪芯褋褌懈	胁械褉芯褟褌薪芯褋褌褜	胁械褉芯褟褌薪芯褋褌褜褞
vechnost_N	胁械褔薪芯褋褌褜	noun	胁械褔薪芯褋褌褜	胁械褔薪芯褋褌懈	胁械褔薪芯褋褌懈	胁械褔薪芯褋褌褜	胁械褔薪芯褋褌褜褞
vina_N	胁懈薪邪	noun	胁懈薪邪	胁懈薪褘	胁懈薪械	胁懈薪褍	胁懈薪芯泄
vozmozhnost_N	胁芯蟹屑芯卸薪芯褋褌褜	noun	胁芯蟹屑芯卸薪芯褋褌褜	胁芯蟹屑芯卸薪芯褋褌懈	胁芯蟹屑芯卸薪芯褋褌懈	胁芯蟹屑芯卸薪芯褋褌褜	胁芯蟹屑芯卸薪芯褋褌褜褞
volya_N	胁芯谢褟	noun	胁芯谢褟	胁芯谢懈	胁芯谢械	胁芯谢褞	胁芯谢械泄
vopros_N	胁芯锌褉芯褋	noun	胁芯锌褉芯褋	胁芯锌褉芯褋邪	胁芯锌褉芯褋械	胁芯锌褉芯褋	胁芯锌褉芯褋芯屑
vremya_N	胁褉械屑褟	noun	胁褉械屑褟	胁褉械屑械薪懈	胁褉械屑械薪懈	胁褉械屑褟	胁褉械屑械薪械屑
vybor_N	胁褘斜芯褉	noun	胁褘斜芯褉	胁褘斜芯褉邪	胁褘斜芯褉械	胁褘斜芯褉	胁褘斜芯褉芯屑
vyvod_N	胁褘胁芯写	noun	胁褘胁芯写	胁褘胁芯写邪	胁褘胁芯写械	胁褘胁芯写	胁褘胁芯写芯屑
vyvodimost_N	胁褘胁芯写懈屑芯褋褌褜	noun	胁褘胁芯写懈屑芯褋褌褜	胁褘胁芯写懈屑芯褋褌懈	胁褘胁芯写懈屑芯褋褌懈	胁褘胁芯写懈屑芯褋褌褜	胁褘胁芯写懈屑芯褋褌褜褞
vyskazyvanie_N	胁褘褋泻邪蟹褘胁邪薪懈械	noun	胁褘褋泻邪蟹褘胁邪薪懈械	胁褘褋泻邪蟹褘胁邪薪懈褟	胁褘褋泻邪蟹褘胁邪薪懈懈	胁褘褋泻邪蟹褘胁邪薪懈械	胁褘褋泻邪蟹褘胁邪薪懈械屑
gipoteza_N	谐懈锌芯褌械蟹邪	noun	谐懈锌芯褌械蟹邪	谐懈锌芯褌械蟹褘	谐懈锌芯褌械蟹械	谐懈锌芯褌械蟹褍	谐懈锌芯褌械蟹芯泄
gnev_N	谐薪械胁	noun	谐薪械胁	谐薪械胁邪	谐薪械胁械	谐薪械胁	谐薪械胁芯屑
gordost_N	谐芯褉写芯褋褌褜	noun	谐芯褉写芯褋褌褜	谐芯褉写芯褋褌懈	谐芯褉写芯褋褌懈	谐芯褉写芯褋褌褜	谐芯褉写芯褋褌褜褞
granitsa_N	谐褉邪薪懈褑邪	noun	谐褉邪薪懈褑邪	谐褉邪薪懈褑褘	谐褉邪薪懈褑械	谐褉邪薪懈褑褍	谐褉邪薪懈褑械泄
delat_V	写械谢邪褌褜	verb	写械谢邪褌褜	写械谢邪褌褜	写械谢邪褌褜	写械谢邪褌褜	写械谢邪褌褜
definitsiya_N	写械褎懈薪懈褑懈褟	noun	写械褎懈薪懈褑懈褟	写械褎懈薪懈褑懈懈	写械褎懈薪懈褑懈懈	写械褎懈薪懈褑懈褞	写械褎懈薪懈褑懈械泄
dialog_N	写懈邪谢芯谐	noun	写懈邪谢芯谐	写懈邪谢芯谐邪	写懈邪谢芯谐械	写懈邪谢芯谐	写懈邪谢芯谐芯屑
distinktsiya_N	写懈褋褌懈薪泻褑懈褟	noun	写懈褋褌懈薪泻褑懈褟	写懈褋褌懈薪泻褑懈懈	写懈褋褌懈薪泻褑懈懈	写懈褋褌懈薪泻褑懈褞	写懈褋褌懈薪泻褑懈械泄
doverie_N	写芯胁械褉懈械	noun	写芯胁械褉懈械	写芯胁械褉懈褟	写芯胁械褉懈懈	写芯胁械褉懈械	写芯胁械褉懈械屑
dovod_N	写芯胁芯写	noun	写芯胁芯写	写芯胁芯写邪	写芯胁芯写械	写芯胁芯写	写芯胁芯写芯屑
dokazatelstvo_N	写芯泻邪蟹邪褌械谢褜褋褌胁芯	noun	写芯泻邪蟹邪褌械谢褜褋褌胁芯	写芯泻邪蟹邪褌械谢褜褋褌胁邪	写芯泻邪蟹邪褌械谢褜褋褌胁械	写芯泻邪蟹邪褌械谢褜褋褌胁芯	写芯泻邪蟹邪褌械谢褜褋褌胁芯屑
dolg_N	写芯谢谐	noun	写芯谢谐	写芯谢谐邪	写芯谢谐械	写芯谢谐	写芯谢谐芯屑
dopushchenie_N	写芯锌褍褖械薪懈械	noun	写芯锌褍褖械薪懈械	写芯锌褍褖械薪懈褟	写芯锌褍褖械薪懈懈	写芯锌褍褖械薪懈械	写芯锌褍褖械薪懈械屑
dostatochnost_N	写芯褋褌邪褌芯褔薪芯褋褌褜	noun	写芯褋褌邪褌芯褔薪芯褋褌褜	写芯褋褌邪褌芯褔薪芯褋褌懈	写芯褋褌邪褌芯褔薪芯褋褌懈	写芯褋褌邪褌芯褔薪芯褋褌褜	写芯褋褌邪褌芯褔薪芯褋褌褜褞
dostovernost_N	写芯褋褌芯胁械褉薪芯褋褌褜	noun	写芯褋褌芯胁械褉薪芯褋褌褜	写芯褋褌芯胁械褉薪芯褋褌懈	写芯褋褌芯胁械褉薪芯褋褌懈	写芯褋褌芯胁械褉薪芯褋褌褜	写芯褋褌芯胁械褉薪芯褋褌褜褞
zhizn_N	卸懈蟹薪褜	noun	卸懈蟹薪褜	卸懈蟹薪懈	卸懈蟹薪懈	卸懈蟹薪褜	卸懈蟹薪褜褞
zadacha_N	蟹邪写邪褔邪	noun	蟹邪写邪褔邪	蟹邪写邪褔懈	蟹邪写邪褔械	蟹邪写邪褔褍	蟹邪写邪褔械泄
zaklyuchenie_N	蟹邪泻谢褞褔械薪懈械	noun	蟹邪泻谢褞褔械薪懈械	蟹邪泻谢褞褔械薪懈褟	蟹邪泻谢褞褔械薪懈懈	蟹邪泻谢褞褔械薪懈械	蟹邪泻谢褞褔械薪懈械屑
zapret_N	蟹邪锌褉械褌	noun	蟹邪锌褉械褌	蟹邪锌褉械褌邪	蟹邪锌褉械褌械	蟹邪锌褉械褌	蟹邪锌褉械褌芯屑
znat_V	蟹薪邪褌褜	verb	蟹薪邪褌褜	蟹薪邪褌褜	蟹薪邪褌褜	蟹薪邪褌褜	蟹薪邪褌褜
identichnost_N	懈写械薪褌懈褔薪芯褋褌褜	noun	懈写械薪褌懈褔薪芯褋褌褜	懈写械薪褌懈褔薪芯褋褌懈	懈写械薪褌懈褔薪芯褋褌懈	懈写械薪褌懈褔薪芯褋褌褜	懈写械薪褌懈褔薪芯褋褌褜褞
illyuziya_N	懈谢谢褞蟹懈褟	noun	懈谢谢褞蟹懈褟	懈谢谢褞蟹懈懈	懈谢谢褞蟹懈懈	懈谢谢褞蟹懈褞	懈谢谢褞蟹懈械泄
implikatsiya_N	懈屑锌谢懈泻邪褑懈褟	noun	懈屑锌谢懈泻邪褑懈褟	懈屑锌谢懈泻邪褑懈懈	懈屑锌谢懈泻邪褑懈懈	懈屑锌谢懈泻邪褑懈褞	懈屑锌谢懈泻邪褑懈械泄
interpretatsiya_N	懈薪褌械褉锌褉械褌邪褑懈褟	noun	懈薪褌械褉锌褉械褌邪褑懈褟	懈薪褌械褉锌褉械褌邪褑懈懈	懈薪褌械褉锌褉械褌邪褑懈懈	懈薪褌械褉锌褉械褌邪褑懈褞	懈薪褌械褉锌褉械褌邪褑懈械泄
inferentsiya_N	懈薪褎械褉械薪褑懈褟	noun	懈薪褎械褉械薪褑懈褟	懈薪褎械褉械薪褑懈懈	懈薪褎械褉械薪褑懈懈	懈薪褎械褉械薪褑懈褞	懈薪褎械褉械薪褑懈械泄
isklyuchenie_N	懈褋泻谢褞褔械薪懈械	noun	懈褋泻谢褞褔械薪懈械	懈褋泻谢褞褔械薪懈褟	懈褋泻谢褞褔械薪懈懈	懈褋泻谢褞褔械薪懈械	懈褋泻谢褞褔械薪懈械屑
istina_N	懈褋褌懈薪邪	noun	懈褋褌懈薪邪	懈褋褌懈薪褘	懈褋褌懈薪械	懈褋褌懈薪褍	懈褋褌懈薪芯泄
istinnost_N	懈褋褌懈薪薪芯褋褌褜	noun	懈褋褌懈薪薪芯褋褌褜	懈褋褌懈薪薪芯褋褌懈	懈褋褌懈薪薪芯褋褌懈	懈褋褌懈薪薪芯褋褌褜	懈褋褌懈薪薪芯褋褌褜褞
kvantor_N	泻胁邪薪褌芯褉	noun	泻胁邪薪褌芯褉	泻胁邪薪褌芯褉邪	泻胁邪薪褌芯褉械	泻胁邪薪褌芯褉	泻胁邪薪褌芯褉芯屑
kontakt_N	泻芯薪褌邪泻褌	noun	泻芯薪褌邪泻褌	泻芯薪褌邪泻褌邪	泻芯薪褌邪泻褌械	泻芯薪褌邪泻褌	泻芯薪褌邪泻褌芯屑
kontrprimer_N	泻芯薪褌褉锌褉懈屑械褉	noun	泻芯薪褌褉锌褉懈屑械褉	泻芯薪褌褉锌褉懈屑械褉邪	泻芯薪褌褉锌褉懈屑械褉械	泻芯薪褌褉锌褉懈屑械褉	泻芯薪褌褉锌褉懈屑械褉芯屑
konflikt_N	泻芯薪褎谢懈泻褌	noun	泻芯薪褎谢懈泻褌	泻芯薪褎谢懈泻褌邪	泻芯薪褎谢懈泻褌械	泻芯薪褎谢懈泻褌	泻芯薪褎谢懈泻褌芯屑
konfrontatsiya_N	泻芯薪褎褉芯薪褌邪褑懈褟	noun	泻芯薪褎褉芯薪褌邪褑懈褟	泻芯薪褎褉芯薪褌邪褑懈懈	泻芯薪褎褉芯薪褌邪褑懈懈	泻芯薪褎褉芯薪褌邪褑懈褞	泻芯薪褎褉芯薪褌邪褑懈械泄
korollarij_N	泻芯褉芯谢谢邪褉懈泄	noun	泻芯褉芯谢谢邪褉懈泄	泻芯褉芯谢谢邪褉懈褟	泻芯褉芯谢谢邪褉懈懈	泻芯褉芯谢谢邪褉懈泄	泻芯褉芯谢谢邪褉懈械屑
korrektnost_N	泻芯褉褉械泻褌薪芯褋褌褜	noun	泻芯褉褉械泻褌薪芯褋褌褜	泻芯褉褉械泻褌薪芯褋褌懈	泻芯褉褉械泻褌薪芯褋褌懈	泻芯褉褉械泻褌薪芯褋褌褜	泻芯褉褉械泻褌薪芯褋褌褜褞
kriterij_N	泻褉懈褌械褉懈泄	noun	泻褉懈褌械褉懈泄	泻褉懈褌械褉懈褟	泻褉懈褌械褉懈懈	泻褉懈褌械褉懈泄	泻褉懈褌械褉懈械屑
lemma_N	谢械屑屑邪	noun	谢械屑屑邪	谢械屑屑褘	谢械屑屑械	谢械屑屑褍	谢械屑屑芯泄
logika_N	谢芯谐懈泻邪	noun	谢芯谐懈泻邪	谢芯谐懈泻懈	谢芯谐懈泻械	谢芯谐懈泻褍	谢芯谐懈泻芯泄
lozh_N	谢芯卸褜	noun	谢芯卸褜	谢卸懈	谢卸懈	谢芯卸褜	谢芯卸褜褞
lyubov_N	谢褞斜芯胁褜	noun	谢褞斜芯胁褜	谢褞斜胁懈	谢褞斜胁懈	谢褞斜芯胁褜	谢褞斜芯胁褜褞
modalnost_N	屑芯写邪谢褜薪芯褋褌褜	noun	屑芯写邪谢褜薪芯褋褌褜	屑芯写邪谢褜薪芯褋褌懈	屑芯写邪谢褜薪芯褋褌懈	屑芯写邪谢褜薪芯褋褌褜	屑芯写邪谢褜薪芯褋褌褜褞
molchanie_N	屑芯谢褔邪薪懈械	noun	屑芯谢褔邪薪懈械	屑芯谢褔邪薪懈褟	屑芯谢褔邪薪懈懈	屑芯谢褔邪薪懈械	屑芯谢褔邪薪懈械屑
myslit_V	屑褘褋谢懈褌褜	verb	屑褘褋谢懈褌褜	屑褘褋谢懈褌褜	屑褘褋谢懈褌褜	屑褘褋谢懈褌褜	屑褘褋谢懈褌褜
nadezhda_N	薪邪写械卸写邪	noun	薪邪写械卸写邪	薪邪写械卸写褘	薪邪写械卸写械	薪邪写械卸写褍	薪邪写械卸写芯泄
nadezhnost_N	薪邪写械卸薪芯褋褌褜	noun	薪邪写械卸薪芯褋褌褜	薪邪写械卸薪芯褋褌懈	薪邪写械卸薪芯褋褌懈	薪邪写械卸薪芯褋褌褜	薪邪写械卸薪芯褋褌褜褞
naznachenie_N	薪邪蟹薪邪褔械薪懈械	noun	薪邪蟹薪邪褔械薪懈械	薪邪蟹薪邪褔械薪懈褟	薪邪蟹薪邪褔械薪懈懈	薪邪蟹薪邪褔械薪懈械	薪邪蟹薪邪褔械薪懈械屑
neobhodimost_N	薪械芯斜褏芯写懈屑芯褋褌褜	noun	薪械芯斜褏芯写懈屑芯褋褌褜	薪械芯斜褏芯写懈屑芯褋褌懈	薪械芯斜褏芯写懈屑芯褋褌懈	薪械芯斜褏芯写懈屑芯褋褌褜	薪械芯斜褏芯写懈屑芯褋褌褜褞
neprotivorechivost_N	薪械锌褉芯褌懈胁芯褉械褔懈胁芯褋褌褜	noun	薪械锌褉芯褌懈胁芯褉械褔懈胁芯褋褌褜	薪械锌褉芯褌懈胁芯褉械褔懈胁芯褋褌懈	薪械锌褉芯褌懈胁芯褉械褔懈胁芯褋褌懈	薪械锌褉芯褌懈胁芯褉械褔懈胁芯褋褌褜	薪械锌褉芯褌懈胁芯褉械褔懈胁芯褋褌褜褞
nesovmestimost_N	薪械褋芯胁屑械褋褌懈屑芯褋褌褜	noun	薪械褋芯胁屑械褋褌懈屑芯褋褌褜	薪械褋芯胁屑械褋褌懈屑芯褋褌懈	薪械褋芯胁屑械褋褌懈屑芯褋褌懈	薪械褋芯胁屑械褋褌懈屑芯褋褌褜	薪械褋芯胁屑械褋褌懈屑芯褋褌褜褞
nichto_N	薪懈褔褌芯	noun	薪懈褔褌芯	薪懈褔械谐芯	薪懈褔械屑	薪懈褔褌芯	薪懈褔褌芯屑
obida_N	芯斜懈写邪	noun	芯斜懈写邪	芯斜懈写褘	芯斜懈写械	芯斜懈写褍	芯斜懈写芯泄
obosnovanie_N	芯斜芯褋薪芯胁邪薪懈械	noun	芯斜芯褋薪芯胁邪薪懈械	芯斜芯褋薪芯胁邪薪懈褟	芯斜芯褋薪芯胁邪薪懈懈	芯斜芯褋薪芯胁邪薪懈械	芯斜芯褋薪芯胁邪薪懈械屑
obyasnenie_N	芯斜褗褟褋薪械薪懈械	noun	芯斜褗褟褋薪械薪懈械	芯斜褗褟褋薪械薪懈褟	芯斜褗褟褋薪械薪懈懈	芯斜褗褟褋薪械薪懈械	芯斜褗褟褋薪械薪懈械屑
obyazannost_N	芯斜褟蟹邪薪薪芯褋褌褜	noun	芯斜褟蟹邪薪薪芯褋褌褜	芯斜褟蟹邪薪薪芯褋褌懈	芯斜褟蟹邪薪薪芯褋褌懈	芯斜褟蟹邪薪薪芯褋褌褜	芯斜褟蟹邪薪薪芯褋褌褜褞
obyazatelstvo_N	芯斜褟蟹邪褌械谢褜褋褌胁芯	noun	芯斜褟蟹邪褌械谢褜褋褌胁芯	芯斜褟蟹邪褌械谢褜褋褌胁邪	芯斜褟蟹邪褌械谢褜褋褌胁械	芯斜褟蟹邪褌械谢褜褋褌胁芯	芯斜褟蟹邪褌械谢褜褋褌胁芯屑
ogranichenie_N	芯谐褉邪薪懈褔械薪懈械	noun	芯谐褉邪薪懈褔械薪懈械	芯谐褉邪薪懈褔械薪懈褟	芯谐褉邪薪懈褔械薪懈懈	芯谐褉邪薪懈褔械薪懈械	芯谐褉邪薪懈褔械薪懈械屑
odinochestvo_N	芯写懈薪芯褔械褋褌胁芯	noun	芯写懈薪芯褔械褋褌胁芯	芯写懈薪芯褔械褋褌胁邪	芯写懈薪芯褔械褋褌胁械	芯写懈薪芯褔械褋褌胁芯	芯写懈薪芯褔械褋褌胁芯屑
opisanie_N	芯锌懈褋邪薪懈械	noun	芯锌懈褋邪薪懈械	芯锌懈褋邪薪懈褟	芯锌懈褋邪薪懈懈	芯锌懈褋邪薪懈械	芯锌懈褋邪薪懈械屑
opredelenie_N	芯锌褉械写械谢械薪懈械	noun	芯锌褉械写械谢械薪懈械	芯锌褉械写械谢械薪懈褟	芯锌褉械写械谢械薪懈懈	芯锌褉械写械谢械薪懈械	芯锌褉械写械谢械薪懈械屑
oproverzhenie_N	芯锌褉芯胁械褉卸械薪懈械	noun	芯锌褉芯胁械褉卸械薪懈械	芯锌褉芯胁械褉卸械薪懈褟	芯锌褉芯胁械褉卸械薪懈懈	芯锌褉芯胁械褉卸械薪懈械	芯锌褉芯胁械褉卸械薪懈械屑
osnovanie_N	芯褋薪芯胁邪薪懈械	noun	芯褋薪芯胁邪薪懈械	芯褋薪芯胁邪薪懈褟	芯褋薪芯胁邪薪懈懈	芯褋薪芯胁邪薪懈械	芯褋薪芯胁邪薪懈械屑
osnovyvat_V	芯褋薪芯胁褘胁邪褌褜	verb	芯褋薪芯胁褘胁邪褌褜	芯褋薪芯胁褘胁邪褌褜	芯褋薪芯胁褘胁邪褌褜	芯褋薪芯胁褘胁邪褌褜	芯褋薪芯胁褘胁邪褌褜
otvet_N	芯褌胁械褌	noun	芯褌胁械褌	芯褌胁械褌邪	芯褌胁械褌械	芯褌胁械褌	芯褌胁械褌芯屑
otvetstvennost_N	芯褌胁械褌褋褌胁械薪薪芯褋褌褜	noun	芯褌胁械褌褋褌胁械薪薪芯褋褌褜	芯褌胁械褌褋褌胁械薪薪芯褋褌懈	芯褌胁械褌褋褌胁械薪薪芯褋褌懈	芯褌胁械褌褋褌胁械薪薪芯褋褌褜	芯褌胁械褌褋褌胁械薪薪芯褋褌褜褞
otrazhenie_N	芯褌褉邪卸械薪懈械	noun	芯褌褉邪卸械薪懈械	芯褌褉邪卸械薪懈褟	芯褌褉邪卸械薪懈懈	芯褌褉邪卸械薪懈械	芯褌褉邪卸械薪懈械屑
oshibka_N	芯褕懈斜泻邪	noun	芯褕懈斜泻邪	芯褕懈斜泻懈	芯褕懈斜泻械	芯褕懈斜泻褍	芯褕懈斜泻芯泄
pamyat_N	锌邪屑褟褌褜	noun	锌邪屑褟褌褜	锌邪屑褟褌懈	锌邪屑褟褌懈	锌邪屑褟褌褜	锌邪屑褟褌褜褞
pozitsiya_N	锌芯蟹懈褑懈褟	noun	锌芯蟹懈褑懈褟	锌芯蟹懈褑懈懈	锌芯蟹懈褑懈懈	锌芯蟹懈褑懈褞	锌芯蟹懈褑懈械泄
ponimanie_N	锌芯薪懈屑邪薪懈械	noun	锌芯薪懈屑邪薪懈械	锌芯薪懈屑邪薪懈褟	锌芯薪懈屑邪薪懈懈	锌芯薪懈屑邪薪懈械	锌芯薪懈屑邪薪懈械屑
ponimat_V	锌芯薪懈屑邪褌褜	verb	锌芯薪懈屑邪褌褜	锌芯薪懈屑邪褌褜	锌芯薪懈屑邪褌褜	锌芯薪懈屑邪褌褜	锌芯薪懈屑邪褌褜
ponyatie_N	锌芯薪褟褌懈械	noun	锌芯薪褟褌懈械	锌芯薪褟褌懈褟	锌芯薪褟褌懈懈	锌芯薪褟褌懈械	锌芯薪褟褌懈械屑
posylka_N	锌芯褋褘谢泻邪	noun	锌芯褋褘谢泻邪	锌芯褋褘谢泻懈	锌芯褋褘谢泻械	锌芯褋褘谢泻褍	锌芯褋褘谢泻芯泄
pravda_N	锌褉邪胁写邪	noun	锌褉邪胁写邪	锌褉邪胁写褘	锌褉邪胁写械	锌褉邪胁写褍	锌褉邪胁写芯泄
pravo_N	锌褉邪胁芯	noun	锌褉邪胁芯	锌褉邪胁邪	锌褉邪胁械	锌褉邪胁芯	锌褉邪胁芯屑
predpolozhenie_N	锌褉械写锌芯谢芯卸械薪懈械	noun	锌褉械写锌芯谢芯卸械薪懈械	锌褉械写锌芯谢芯卸械薪懈褟	锌褉械写锌芯谢芯卸械薪懈懈	锌褉械写锌芯谢芯卸械薪懈械	锌褉械写锌芯谢芯卸械薪懈械屑
predposylka_N	锌褉械写锌芯褋褘谢泻邪	noun	锌褉械写锌芯褋褘谢泻邪	锌褉械写锌芯褋褘谢泻懈	锌褉械写锌芯褋褘谢泻械	锌褉械写锌芯褋褘谢泻褍	锌褉械写锌芯褋褘谢泻芯泄
prinuzhdenie_N	锌褉懈薪褍卸写械薪懈械	noun	锌褉懈薪褍卸写械薪懈械	锌褉懈薪褍卸写械薪懈褟	锌褉懈薪褍卸写械薪懈懈	锌褉懈薪褍卸写械薪懈械	锌褉懈薪褍卸写械薪懈械屑
prisutstvie_N	锌褉懈褋褍褌褋褌胁懈械	noun	锌褉懈褋褍褌褋褌胁懈械	锌褉懈褋褍褌褋褌胁懈褟	锌褉懈褋褍褌褋褌胁懈懈	锌褉懈褋褍褌褋褌胁懈械	锌褉懈褋褍褌褋褌胁懈械屑
prichina_N	锌褉懈褔懈薪邪	noun	锌褉懈褔懈薪邪	锌褉懈褔懈薪褘	锌褉懈褔懈薪械	锌褉懈褔懈薪褍	锌褉懈褔懈薪芯泄
proverka_N	锌褉芯胁械褉泻邪	noun	锌褉芯胁械褉泻邪	锌褉芯胁械褉泻懈	锌褉芯胁械褉泻械	锌褉芯胁械褉泻褍	锌褉芯胁械褉泻芯泄
proniknut_V	锌褉芯薪懈泻薪褍褌褜	verb	锌褉芯薪懈泻薪褍褌褜	锌褉芯薪懈泻薪褍褌褜	锌褉芯薪懈泻薪褍褌褜	锌褉芯薪懈泻薪褍褌褜	锌褉芯薪懈泻薪褍褌褜
protivorechie_N	锌褉芯褌懈胁芯褉械褔懈械	noun	锌褉芯褌懈胁芯褉械褔懈械	锌褉芯褌懈胁芯褉械褔懈褟	锌褉芯褌懈胁芯褉械褔懈懈	锌褉芯褌懈胁芯褉械褔懈械	锌褉芯褌懈胁芯褉械褔懈械屑
pustota_N	锌褍褋褌芯褌邪	noun	锌褍褋褌芯褌邪	锌褍褋褌芯褌褘	锌褍褋褌芯褌械	锌褍褋褌芯褌褍	锌褍褋褌芯褌芯泄
ravnosilnost_N	褉邪胁薪芯褋懈谢褜薪芯褋褌褜	noun	褉邪胁薪芯褋懈谢褜薪芯褋褌褜	褉邪胁薪芯褋懈谢褜薪芯褋褌懈	褉邪胁薪芯褋懈谢褜薪芯褋褌懈	褉邪胁薪芯褋懈谢褜薪芯褋褌褜	褉邪胁薪芯褋懈谢褜薪芯褋褌褜褞
radost_N	褉邪写芯褋褌褜	noun	褉邪写芯褋褌褜	褉邪写芯褋褌懈	褉邪写芯褋褌懈	褉邪写芯褋褌褜	褉邪写芯褋褌褜褞
razgranichenie_N	褉邪蟹谐褉邪薪懈褔械薪懈械	noun	褉邪蟹谐褉邪薪懈褔械薪懈械	褉邪蟹谐褉邪薪懈褔械薪懈褟	褉邪蟹谐褉邪薪懈褔械薪懈懈	褉邪蟹谐褉邪薪懈褔械薪懈械	褉邪蟹谐褉邪薪懈褔械薪懈械屑
razlichat_V	褉邪蟹谢懈褔邪褌褜	verb	褉邪蟹谢懈褔邪褌褜	褉邪蟹谢懈褔邪褌褜	褉邪蟹谢懈褔邪褌褜	褉邪蟹谢懈褔邪褌褜	褉邪蟹谢懈褔邪褌褜
razlichie_N	褉邪蟹谢懈褔懈械	noun	褉邪蟹谢懈褔懈械	褉邪蟹谢懈褔懈褟	褉邪蟹谢懈褔懈懈	褉邪蟹谢懈褔懈械	褉邪蟹谢懈褔懈械屑
raznitsa_N	褉邪蟹薪懈褑邪	noun	褉邪蟹薪懈褑邪	褉邪蟹薪懈褑褘	褉邪蟹薪懈褑械	褉邪蟹薪懈褑褍	褉邪蟹薪懈褑械泄
razreshenie_N	褉邪蟹褉械褕械薪懈械	noun	褉邪蟹褉械褕械薪懈械	褉邪蟹褉械褕械薪懈褟	褉邪蟹褉械褕械薪懈懈	褉邪蟹褉械褕械薪懈械	褉邪蟹褉械褕械薪懈械屑
razum_N	褉邪蟹褍屑	noun	褉邪蟹褍屑	褉邪蟹褍屑邪	褉邪蟹褍屑械	褉邪蟹褍屑	褉邪蟹褍屑芯屑
rakurs_N	褉邪泻褍褉褋	noun	褉邪泻褍褉褋	褉邪泻褍褉褋邪	褉邪泻褍褉褋械	褉邪泻褍褉褋	褉邪泻褍褉褋芯屑
remont_N	褉械屑芯薪褌	noun	褉械屑芯薪褌	褉械屑芯薪褌邪	褉械屑芯薪褌械	褉械屑芯薪褌	褉械屑芯薪褌芯屑
reshenie_N	褉械褕械薪懈械	noun	褉械褕械薪懈械	褉械褕械薪懈褟	褉械褕械薪懈懈	褉械褕械薪懈械	褉械褕械薪懈械屑
svidetelstvo_N	褋胁懈写械褌械谢褜褋褌胁芯	noun	褋胁懈写械褌械谢褜褋褌胁芯	褋胁懈写械褌械谢褜褋褌胁邪	褋胁懈写械褌械谢褜褋褌胁械	褋胁懈写械褌械谢褜褋褌胁芯	褋胁懈写械褌械谢褜褋褌胁芯屑
svoboda_N	褋胁芯斜芯写邪	noun	褋胁芯斜芯写邪	褋胁芯斜芯写褘	褋胁芯斜芯写械	褋胁芯斜芯写褍	褋胁芯斜芯写芯泄
sillogizm_N	褋懈谢谢芯谐懈蟹屑	noun	褋懈谢谢芯谐懈蟹屑	褋懈谢谢芯谐懈蟹屑邪	褋懈谢谢芯谐懈蟹屑械	褋懈谢谢芯谐懈蟹屑	褋懈谢谢芯谐懈蟹屑芯屑
skazat_V	褋泻邪蟹邪褌褜	verb	褋泻邪蟹邪褌褜	褋泻邪蟹邪褌褜	褋泻邪蟹邪褌褜	褋泻邪蟹邪褌褜	褋泻邪蟹邪褌褜
sledstvie_N	褋谢械写褋褌胁懈械	noun	褋谢械写褋褌胁懈械	褋谢械写褋褌胁懈褟	褋谢械写褋褌胁懈懈	褋谢械写褋褌胁懈械	褋谢械写褋褌胁懈械屑
smert_N	褋屑械褉褌褜	noun	褋屑械褉褌褜	褋屑械褉褌懈	褋屑械褉褌懈	褋屑械褉褌褜	褋屑械褉褌褜褞
smirenie_N	褋屑懈褉械薪懈械	noun	褋屑懈褉械薪懈械	褋屑懈褉械薪懈褟	褋屑懈褉械薪懈懈	褋屑懈褉械薪懈械	褋屑懈褉械薪懈械屑
smysl_N	褋屑褘褋谢	noun	褋屑褘褋谢	褋屑褘褋谢邪	褋屑褘褋谢械	褋屑褘褋谢	褋屑褘褋谢芯屑
soglasie_N	褋芯谐谢邪褋懈械	noun	褋芯谐谢邪褋懈械	褋芯谐谢邪褋懈褟	褋芯谐谢邪褋懈懈	褋芯谐谢邪褋懈械	褋芯谐谢邪褋懈械屑
soglasovannost_N	褋芯谐谢邪褋芯胁邪薪薪芯褋褌褜	noun	褋芯谐谢邪褋芯胁邪薪薪芯褋褌褜	褋芯谐谢邪褋芯胁邪薪薪芯褋褌懈	褋芯谐谢邪褋芯胁邪薪薪芯褋褌懈	褋芯谐谢邪褋芯胁邪薪薪芯褋褌褜	褋芯谐谢邪褋芯胁邪薪薪芯褋褌褜褞
soznanie_N	褋芯蟹薪邪薪懈械	noun	褋芯蟹薪邪薪懈械	褋芯蟹薪邪薪懈褟	褋芯蟹薪邪薪懈懈	褋芯蟹薪邪薪懈械	褋芯蟹薪邪薪懈械屑
somnenie_N	褋芯屑薪械薪懈械	noun	褋芯屑薪械薪懈械	褋芯屑薪械薪懈褟	褋芯屑薪械薪懈懈	褋芯屑薪械薪懈械	褋芯屑薪械薪懈械屑
sposobnost_N	褋锌芯褋芯斜薪芯褋褌褜	noun	褋锌芯褋芯斜薪芯褋褌褜	褋锌芯褋芯斜薪芯褋褌懈	褋锌芯褋芯斜薪芯褋褌懈	褋锌芯褋芯斜薪芯褋褌褜	褋锌芯褋芯斜薪芯褋褌褜褞
spravedlivost_N	褋锌褉邪胁械写谢懈胁芯褋褌褜	noun	褋锌褉邪胁械写谢懈胁芯褋褌褜	褋锌褉邪胁械写谢懈胁芯褋褌懈	褋锌褉邪胁械写谢懈胁芯褋褌懈	褋锌褉邪胁械写谢懈胁芯褋褌褜	褋锌褉邪胁械写谢懈胁芯褋褌褜褞
stradanie_N	褋褌褉邪写邪薪懈械	noun	褋褌褉邪写邪薪懈械	褋褌褉邪写邪薪懈褟	褋褌褉邪写邪薪懈懈	褋褌褉邪写邪薪懈械	褋褌褉邪写邪薪懈械屑
strah_N	褋褌褉邪褏	noun	褋褌褉邪褏	褋褌褉邪褏邪	褋褌褉邪褏械	褋褌褉邪褏	褋褌褉邪褏芯屑
styd_N	褋褌褘写	noun	褋褌褘写	褋褌褘写邪	褋褌褘写械	褋褌褘写	褋褌褘写芯屑
sudba_N	褋褍写褜斜邪	noun	褋褍写褜斜邪	褋褍写褜斜褘	褋褍写褜斜械	褋褍写褜斜褍	褋褍写褜斜芯泄
suzhdenie_N	褋褍卸写械薪懈械	noun	褋褍卸写械薪懈械	褋褍卸写械薪懈褟	褋褍卸写械薪懈懈	褋褍卸写械薪懈械	褋褍卸写械薪懈械屑
sushchestvovanie_N	褋褍褖械褋褌胁芯胁邪薪懈械	noun	褋褍褖械褋褌胁芯胁邪薪懈械	褋褍褖械褋褌胁芯胁邪薪懈褟	褋褍褖械褋褌胁芯胁邪薪懈懈	褋褍褖械褋褌胁芯胁邪薪懈械	褋褍褖械褋褌胁芯胁邪薪懈械屑
sushchestvovat_V	褋褍褖械褋褌胁芯胁邪褌褜	verb	褋褍褖械褋褌胁芯胁邪褌褜	褋褍褖械褋褌胁芯胁邪褌褜	褋褍褖械褋褌胁芯胁邪褌褜	褋褍褖械褋褌胁芯胁邪褌褜	褋褍褖械褋褌胁芯胁邪褌褜
tezis_N	褌械蟹懈褋	noun	褌械蟹懈褋	褌械蟹懈褋邪	褌械蟹懈褋械	褌械蟹懈褋	褌械蟹懈褋芯屑
telo_N	褌械谢芯	noun	褌械谢芯	褌械谢邪	褌械谢械	褌械谢芯	褌械谢芯屑
teorema_N	褌械芯褉械屑邪	noun	褌械芯褉械屑邪	褌械芯褉械屑褘	褌械芯褉械屑械	褌械芯褉械屑褍	褌械芯褉械屑芯泄
termin_N	褌械褉屑懈薪	noun	褌械褉屑懈薪	褌械褉屑懈薪邪	褌械褉屑懈薪械	褌械褉屑懈薪	褌械褉屑懈薪芯屑
toska_N	褌芯褋泻邪	noun	褌芯褋泻邪	褌芯褋泻懈	褌芯褋泻械	褌芯褋泻褍	褌芯褋泻芯泄
trevoga_N	褌褉械胁芯谐邪	noun	褌褉械胁芯谐邪	褌褉械胁芯谐懈	褌褉械胁芯谐械	褌褉械胁芯谐褍	褌褉械胁芯谐芯泄
uslovie_N	褍褋谢芯胁懈械	noun	褍褋谢芯胁懈械	褍褋谢芯胁懈褟	褍褋谢芯胁懈懈	褍褋谢芯胁懈械	褍褋谢芯胁懈械屑
utverzhdenie_N	褍褌胁械褉卸写械薪懈械	noun	褍褌胁械褉卸写械薪懈械	褍褌胁械褉卸写械薪懈褟	褍褌胁械褉卸写械薪懈懈	褍褌胁械褉卸写械薪懈械	褍褌胁械褉卸写械薪懈械屑
utochnyat_V	褍褌芯褔薪褟褌褜	verb	褍褌芯褔薪褟褌褜	褍褌芯褔薪褟褌褜	褍褌芯褔薪褟褌褜	褍褌芯褔薪褟褌褜	褍褌芯褔薪褟褌褜
utrata_N	褍褌褉邪褌邪	noun	褍褌褉邪褌邪	褍褌褉邪褌褘	褍褌褉邪褌械	褍褌褉邪褌褍	褍褌褉邪褌芯泄
